Name,Context,Cleaned,Selective,Selective_Reduced,TF_Based
Backend Developer.docx,"Backend Developer - Python/Django



We are looking for Python/Django developers with 2-4 + years of experience to be part of our growing team. The role is of Python/Django Backend Web Developer who can handle the challenging work of Web applications development using Python / Django framework.

Required Skills:

Strong working knowledge of constructs of HTTP, RESTful APIs and WebSockets.

Build and maintain highly scalable Python processes for the purpose of data collection, manipulation, data pruning, trending and analytics, etc.

Strong understanding of Python and good knowledge of various Python Libraries (NumPy, Pandas, ORM libraries etc.), API's and toolkits

Able to integrate multiple data sources and databases into one system

Working knowledge of web templating engine for python such as Jinja2 etc

Ability to integrate user-facing elements developed by front-end developers with server-side logic.

Ability to integrate data storage solutions and caches.

Understanding of the threading limitations of Python, and multi-process architecture

Understanding of fundamental design principles behind a scalable application

Good understanding of event-driven programming in Python

Good knowledge of PostGRESQL

Able to create database schemas that represent and support business processes

Strong Analytical, Problem Solving & Innovative Skills.

Working knowledge of version control tools (GIT/SVN).

Experience/knowledge of working on the LINUX environment.

Attention to detail, problem-solver with strong analytical skill, good sense of urgency

Ability to carry out tasks without supervision and able to meet tight deadlines

Good Writing & Communication Skills. The candidate should be able to communicate with potential Clients and gather inputs/change requests.

Work with a performance oriented team driven by ownership and open to experiments

Strong interpersonal skills with excellent written and verbal communication

Responsibilities:

Develop back-end components to improve responsiveness and overall performance

Designing and implementing system architecture to handle scale

Coordinate with Frontend Dev team & Creating APIs (w/ DjangoRestFramework)

Integrating of web pages with Backend using templating engines for Python

Build bulletproof API integrations with third party APIs for various use cases

Good to have (Additional Skills):

Relevant full stack experience.

You've worked with core AWS services in the past and have experience with EC2, ELB, AutoScaling, CloudFront, S3

Demonstrable work/project portfolio online.

Working knowledge of front end technologies like Javascript, JQuery, HTML, and CSS

A good sense of design and aesthetics.

Experience/Zeal to work in a fast-paced startup environment.

Candidates who can join immediately will be preferredDevelop very high sense of ownership, the zeal to build scalable applications

Job Type: Full-time

Salary: ₹35,000.00 - ₹55,000.00 per month

Experience:

Django Development: 1 year (Preferred)

total work: 2 years (Preferred)

Education:

Bachelor's (Preferred)

Work Remotely:

Temporarily due to COVID-19",Backend developer PythonDjango look PythonDjango developer year experience part grow team role PythonDjango Backend web developer handle challenge work web application development use Python Django framework Required Skills strong work knowledge construct HTTP restful api WebSockets Build maintain highly scalable Python process purpose datum collection manipulation datum prune trend analytic strong understand Python good knowledge various Python Libraries NumPy Pandas ORM librarie api toolkit able integrate multiple datum source database system working knowledge web template engine python Jinja2 Ability integrate userface element develop frontend developer serverside logic ability integrate data storage solution cache understand threading limitation Python multiprocess architecture understand fundamental design principle scalable application good understand eventdriven program Python good knowledge postgresql able create database schema represent support business process Strong Analytical Problem Solving Innovative Skills Working knowledge version control tool GITSVN Experienceknowledge work LINUX environment attention detail problemsolver strong analytical skill good sense urgency ability carry task supervision able meet tight deadline Good write Communication Skills candidate able communicate potential client gather inputschange request work performance orient team drive ownership open experiment strong interpersonal skill excellent write verbal communication responsibility develop backend component improve responsiveness overall performance Designing implement system architecture handle scale Coordinate Frontend Dev team create api w DjangoRestFramework Integrating web page Backend use template engine Python Build bulletproof API integration third party api various use case Good Additional Skills relevant full stack experience work core AWS service experience EC2 ELB AutoScaling CloudFront S3 Demonstrable workproject portfolio online working knowledge front end technology Javascript JQuery HTML CSS good sense design aesthetic ExperienceZeal work fastpace startup environment candidate join immediately preferredDevelop high sense ownership zeal build scalable application Job Type Fulltime Salary month Experience Django Development year preferred total work year Preferred Education Bachelors Preferred work remotely temporarily due,represent Libraries overall verbal Build AutoScaling NumPy Salary trend threading Working gather urgency HTTP eventdriven Designing handle able scale source EC2 Coordinate python analytic Education meet environment role deadline Problem aesthetic ExperienceZeal detail page task JQuery database principle integration strong technology Required S3 online challenge application business maintain scalable open Integrating supervision use bulletproof communicate excellent full Job Javascript experiment working analytical component due Strong Good performance GITSVN librarie Jinja2 ORM engine architecture good PythonDjango develop WebSockets api orient knowledge data template w communication skill toolkit interpersonal system core tool request relevant DjangoRestFramework potential front carry Dev fastpace integrate Python element drive prune create join serverside build AWS month Experienceknowledge inputschange immediately Pandas improve HTML program version Additional support process grow party Ability construct postgresql schema Demonstrable Fulltime write responsibility ELB portfolio Type Frontend team fundamental third datum logic Django responsiveness Solving Experience sense experience ability solution high Skills design multiprocess understand Preferred frontend manipulation Communication preferred control candidate workproject end CSS framework CloudFront LINUX stack collection work backend userface developer Backend startup purpose case storage year attention service web limitation Analytical development total multiple preferredDevelop Innovative implement zeal various problemsolver highly look restful Development part API remotely tight temporarily client Bachelors ownership cache,Build AutoScaling NumPy Salary trend Working gather urgency HTTP Designing scale source EC2 Coordinate python Education environment role deadline Problem ExperienceZeal detail page task JQuery database principle integration technology Required S3 online challenge application business supervision use bulletproof Job Javascript component performance GITSVN librarie Jinja2 ORM engine architecture PythonDjango WebSockets api orient knowledge data template communication skill toolkit system core tool DjangoRestFramework front Dev fastpace Python element drive prune create join serverside AWS month Experienceknowledge inputschange Pandas HTML program version support process party Ability postgresql schema Demonstrable Fulltime responsibility ELB portfolio Type Frontend team datum logic Django responsiveness Solving Experience sense experience ability solution design multiprocess frontend manipulation Communication control candidate workproject end CSS framework CloudFront LINUX stack collection work developer Backend startup purpose case storage year attention service web limitation development preferredDevelop Innovative implement zeal Development part API client Bachelors ownership cache,ability able additional aesthetic analytic analytical api application architecture attention autoscaling aws bachelors backend build bulletproof business cache candidate carry case challenge client cloudfront collection communicate communication component construct control coordinate core create css data database datum deadline demonstrable design designing detail dev develop developer development django djangorestframework drive due ec2 education elb element end engine environment eventdriven excellent experience experienceknowledge experiencezeal experiment fastpace framework front frontend full fulltime fundamental gather gitsvn good grow handle high highly html http immediately implement improve innovative inputschange integrate integrating integration interpersonal javascript jinja2 job join jquery knowledge librarie libraries limitation linux logic look maintain manipulation meet month multiple multiprocess numpy online open orient orm overall ownership page pandas part party performance portfolio postgresql potential preferred preferreddevelop principle problem problemsolver process program prune purpose python pythondjango relevant remotely represent request required responsibility responsiveness restful role s3 salary scalable scale schema sense serverside service skill skills solution solving source stack startup storage strong supervision support system task team technology template temporarily third threading tight tool toolkit total trend type understand urgency use userface various verbal version web websockets work working workproject write year zeal
Billing cum Logistics Manager.docx,"Billing cum Logistics Manager

Job Summary
Urgent requirement of Billing cum Logistics Manager for Ecommerce Company
Locatio - Gurgaon
Company profile : detel-india.com
Responsibilities and Duties
Total Billing Monitor & Controlling
Invoice validation before sending to Customer with Accuracy
E-Commerce Billing, Monthly Fixed and Variable Billing.
Follow up & Clearance from Operation for specific Remarks in PODs (Shortages/Damages Etc)
Deductions booking off
Proper Documentation (Invoices/PODs Etc)
Reconciliation:
POD Reconciliation (Damages/Shortages/Other Remarks) & Resolution
Deductions Reconciliation & Recovery Preparation
Pending POD Controlling & Monitor",billing cum Logistics Manager Job Summary Urgent requirement Billing cum Logistics Manager Ecommerce Company Locatio Gurgaon Company profile detelindiacom Responsibilities Duties Total Billing monitor controlling Invoice validation send Customer Accuracy ECommerce Billing Monthly fix Variable Billing Follow Clearance Operation specific remark pod ShortagesDamages Etc deduction book proper Documentation invoicespods etc reconciliation pod Reconciliation damagesshortagesother Remarks Resolution Deductions Reconciliation Recovery Preparation pende pod Controlling monitor,Summary billing Logistics fix deduction Remarks monitor Billing Responsibilities Monthly Total requirement Invoice remark proper damagesshortagesother Follow reconciliation pende detelindiacom book cum Locatio etc Reconciliation pod Recovery Etc Accuracy Customer Clearance Resolution Ecommerce send controlling profile Company Duties ECommerce Manager Urgent Operation Deductions Preparation validation invoicespods specific Controlling Gurgaon Variable ShortagesDamages Documentation Job,Summary billing Logistics deduction Billing Responsibilities Monthly requirement Invoice damagesshortagesother Follow reconciliation pende detelindiacom book cum Locatio Reconciliation pod Recovery Etc Accuracy Customer Clearance Resolution Ecommerce profile Company ECommerce Manager Urgent Operation Preparation validation Gurgaon Variable Documentation Job,accuracy billing book clearance company controlling cum customer damagesshortagesother deduction deductions detelindiacom documentation duties ecommerce etc fix follow gurgaon invoice invoicespods job locatio logistics manager monitor monthly operation pende pod preparation profile proper reconciliation recovery remark remarks requirement resolution responsibilities send shortagesdamages specific summary total urgent validation variable
Data Scientist.docx,"Data Scientist/ ML Engineer

Game Change Solutions

-

Gurgaon, Haryana

Temporarily remote

₹20,00,000 - ₹25,00,000 a year

We are looking for a data scientist that will help us discover the information hidden in vast amounts of data and help us make smarter decisions to deliver even better products. Your primary focus will be in applying data mining techniques, doing statistical analysis, and building high quality prediction systems integrated with our products. Data Scientist at GameChange must be an energetic self-starter who can quickly grasp the company’s vision, develop specific tactical plans, and begin implementation upon appropriate approvals. The candidate must be resourceful and able to deliver on a plan defined.

Responsibilities –

Data Crunching and data massaging on structured and unstructured data including Numerical, Text,

Audio and Video data

Implementation/fine-tuning of machine learning algorithms

Conducting Data science/machine learning experiments and presenting insights

Building innovative data products using cutting edge tools and technologies

Conduct data analysis independently or with limited supervision to generate business insights

Conduct diagnostic on the data to identify the improvement opportunities, design data-backed

performance improvement strategy, liaise with internal teams

Record keeping and data warehousing to enable Advanced Analytics operations for generating

meaningful business insights

Develop high quality client deliverables such as R models, Python scripts etc.

Skills required -

Excellent understanding of machine learning techniques and algorithms, such as k-NN, Naive Bayes,

SVM, Decision Forests, CNN, RNN, LSTM etc.

Experience with common data science toolkits, such as R, Weka, NumPy, OpenCV, MatLab, etc.

Great communication skills

Experience with data visualisation tools, such as D3.js, GGplot, etc.

Proficiency in using query languages such as SQL, Hive, Pig

Experience with NoSQL databases, such as MongoDB, Cassandra, HBase

Good applied statistics skills, such as distributions, statistical testing, regression, etc.

Good scripting and programming skills

Job Type: Full-time

Salary: ₹2,000,000.00 - ₹2,500,000.00 per year

Experience:

Data Science: 2 years (Preferred)

work: 1 year (Preferred)

Education:

Bachelor's (Preferred)",Data Scientist ML Engineer Game Change Solutions Gurgaon Haryana temporarily remote year look data scientist help discover information hide vast amount datum help make smart decision deliver even well product primary focus apply datum mining technique statistical analysis build high quality prediction system integrate product Data Scientist GameChange energetic selfstarter quickly grasp company vision develop specific tactical plan begin implementation appropriate approval candidate resourceful able deliver plan define Responsibilities Data Crunching datum massage structure unstructured datum include Numerical Text Audio video data implementationfinetune machine learn algorithm conduct Data sciencemachine learn experiment present insight build innovative data product use cut edge tool technology Conduct datum analysis independently limit supervision generate business insight conduct diagnostic datum identify improvement opportunity design databacke performance improvement strategy liaise internal team record keep datum warehousing enable Advanced Analytics operation generate meaningful business insight develop high quality client deliverable r model Python script skill require excellent understanding machine learn technique algorithm kNN Naive Bayes SVM decision forest CNN RNN lstm experience common datum science toolkit R Weka NumPy opencv MatLab great communication skill experience datum visualisation tool D3js GGplot Proficiency use query language SQL Hive Pig Experience NoSQL database MongoDB Cassandra HBase Good apply statistic skill distribution statistical testing regression good scripting programming skill Job Type Fulltime Salary year Experience Data Science year preferred work year Preferred Education Bachelors Preferred,common machine NumPy algorithm Salary well visualisation Text able remote Responsibilities GGplot Education Analytics sciencemachine lstm Conduct RNN deliverable Change database NoSQL keep analysis statistic technology statistical conduct Engineer information scientist great testing business opportunity Naive energetic specific use supervision Advanced excellent quickly Job SQL implementation Game tactical regression experiment Scientist programming Proficiency quality technique performance diagnostic Good generate enable strategy good appropriate Solutions develop r insight independently data mining help grasp even focus primary communication skill toolkit system tool video include identify Gurgaon kNN Cassandra integrate vision implementationfinetune Python opencv resourceful decision Crunching Audio build begin Hive make Data amount Numerical HBase apply plan approval Bayes discover query hide structure Fulltime deliver unstructured ML smart databacke MongoDB Type script product team forest datum limit SVM scripting warehousing Experience innovative experience present high Science design require Preferred preferred Weka Pig model candidate Bachelors cut record selfstarter science MatLab work operation edge year meaningful language prediction CNN D3js define improvement learn vast internal liaise look R Haryana GameChange temporarily massage client distribution company understanding,machine NumPy algorithm Salary visualisation Text Responsibilities GGplot Education sciencemachine Conduct RNN Change database analysis statistic technology conduct Engineer information scientist testing business opportunity use supervision Job SQL implementation Game regression experiment Scientist programming Proficiency quality technique performance generate strategy r insight data mining help communication skill toolkit system tool video Gurgaon kNN Cassandra vision implementationfinetune Python decision Audio build Hive Data amount Numerical HBase plan approval Bayes query hide structure Fulltime ML databacke MongoDB Type script product team forest datum limit SVM warehousing Experience experience Science design Weka Pig model candidate record selfstarter science MatLab work operation edge year language prediction CNN D3js improvement liaise look R Haryana GameChange client distribution company,able advanced algorithm amount analysis analytics apply appropriate approval audio bachelors bayes begin build business candidate cassandra change client cnn common communication company conduct crunching cut d3js data databacke database datum decision define deliver deliverable design develop diagnostic discover distribution edge education enable energetic engineer even excellent experience experiment focus forest fulltime game gamechange generate ggplot good grasp great gurgaon haryana hbase help hide high hive identify implementation implementationfinetune improvement include independently information innovative insight integrate internal job keep knn language learn liaise limit look lstm machine make massage matlab meaningful mining ml model mongodb naive nosql numerical numpy opencv operation opportunity performance pig plan prediction preferred present primary product proficiency programming python quality query quickly record regression remote require resourceful responsibilities rnn salary science sciencemachine scientist script scripting selfstarter skill smart solutions specific sql statistic statistical strategy structure supervision svm system tactical team technique technology temporarily testing text tool toolkit type understanding unstructured use vast video vision visualisation warehousing weka well work year
