Name,Context,Cleaned,Selective,Selective_Reduced,TF_Based
DeveloperJobDescription.pdf,"Schedule A � Position Description

Job Title:

Senior Software Developer

Positions This Position Reports To: Development Manager

Positions Reporting to This Position: None

Duties and Responsibilities
The day to day Duties and Responsibilities of the Position are as follows:
Software Engineering Activities  Elicits functional and non-functional requirements from stakeholders. Detects and resolves conflicting requirements. Conducts business analysis and/or technical investigation to provide detail for design or aid in decision making.  Designs to identify and reduce complexity wherever possible. Takes desired qualities into account from requirements (robustness, performance, re-useability etc.). Documents and explains trade-offs and rationale behind designs. Contributes to design discussions.  Code follows CFS standards and conventions. Code meets required standards of quality, including efficiency, maintainability, reliability, and terseness and fitness for purpose.  Tests programs appropriately during and after construction. Balances testing effort according to the risk of changes. Uses appropriate testing techniques. Works together with testers to ensure the application is sufficiently tested (and testable).  Is responsive to production issues when needed.  Uses development tools effectively, e.g. Visual Studio, Subversion, JIRA, Bamboo etc.  Follows CFS development processes. Suggests improvements where appropriate.  Keeps the team informed of progress. Escalates issues appropriately when roadblocks are reached. Manages time efficiently and is considerate of the time of others.
Other Competencies  Works to improve technical skills in the areas needed to perform work tasks effectively. Keeps abreast of new technologies and ways of doing things.  Acquires knowledge in relevant areas of our business and our customers' businesses.  Exercises good judgement in all areas, e.g. making design trade-offs, assessing risks, dealing with others.

 Is engaged in technical, business and ""soft"" aspects of the work. (e.g. pro-active behaviour, participation in team discussions, care and conscientiousness in delivery of work products).
 Good written and verbal communication skills.  Works well together with other developers, managers, and the rest of the business.  Is open to alternative ways of doing things.
Variation of Expectations with Seniority
The expectations set out above will vary according to developer seniority. More Senior Developers are expected to:
 Handle tasks of higher complexity  Be able to work more independently  Take more responsibility within the team  In general, have a higher level of productivity
Key Performance Indicators
Colleague satisfaction as assessed by your team lead, peers and associated project and support staff � note this assessment may be performed either informally by interview or formally via survey subject to the applicable management processes in place at that time. The assessment will include:
 How effectively you execute the above responsibilities (includes pro-activeness , responsiveness and thoroughness)
 How professionally you interact and communicate with your colleagues (and clients if applicable)

",Schedule A Position Description Job Title Senior Software Developer Positions Position Reports Development Manager Positions reporting position None Duties Responsibilities day day Duties Responsibilities Position follow Software Engineering Activities Elicits functional nonfunctional requirement stakeholder detect resolve conflict requirement conduct business analysis andor technical investigation provide detail design aid decision make design identify reduce complexity wherever possible take desire quality account requirement robustness performance reuseability document explain tradeoff rationale behind design Contributes design discussion Code follow cfs standard convention Code meet require standard quality include efficiency maintainability reliability terseness fitness purpose test program appropriately construction balance testing effort accord risk change use appropriate testing technique work together tester ensure application sufficiently test testable responsive production issue need use development tool effectively eg Visual Studio Subversion JIRA bamboo follow CFS development process suggest improvement appropriate Keeps team inform progress escalate issue appropriately roadblock reach Manages time efficiently considerate time other other Competencies Works improve technical skill area need perform work task effectively keep abreast new technology way thing acquire knowledge relevant area business customer business exercise good judgement area eg make design tradeoff assess risk deal other engage technical business soft aspect work eg proactive behaviour participation team discussion care conscientiousness delivery work product Good write verbal communication skill work well together developer manager rest business open alternative way thing Variation Expectations Seniority expectation set vary accord developer seniority More senior developer expect Handle task high complexity be able work independently take responsibility team general high level productivity Key Performance Indicators Colleague satisfaction assess team lead peer associate project support staff note assessment perform informally interview formally survey subject applicable management process place time assessment include how effectively execute responsibility include proactiveness responsiveness thoroughness how professionally interact communicate colleague client applicable,standard Contributes change None verbal reuseability need exercise Title Colleague tradeoff well test Competencies reliability able Responsibilities Positions associate meet assess Expectations detail task technical account behaviour tester production Visual delivery keep analysis efficiency technology engage thing conduct Schedule customer level rationale Activities inform general testing application responsive business Manager participation balance open perform testable use communicate behind Job construction ensure wherever bamboo time day judgement subject detect progress take applicable seniority provide Position quality technique Senior performance Good requirement assessment Seniority aid together good appropriate area peer acquire Manages independently expectation knowledge Elicits interview staff interact Developer More investigation abreast position skill communication follow conscientiousness tool A soft include relevant identify efficiently Code Performance colleague decision functional Subversion andor other satisfaction Keeps thoroughness make robustness aspect improve program CFS care lead professionally effectively reporting Handle support management process reduce roadblock Reports conflict alternative convention proactiveness nonfunctional Engineering write responsibility Indicators Description fitness product team proactive place set effort responsiveness Duties stakeholder informally new formally deal terseness explain JIRA high be design require appropriately maintainability risk Variation desire Works possible document considerate Software work Studio vary sufficiently developer cfs manager way Key purpose discussion suggest resolve rest development eg how complexity note improvement expect senior issue Development productivity project execute reach client accord survey escalate,None reuseability exercise Title Colleague tradeoff well test reliability associate meet detail task account behaviour tester production delivery analysis efficiency technology engage thing conduct Schedule customer level rationale testing application business Manager participation balance perform use communicate Job construction bamboo time day judgement detect progress seniority Position quality technique performance requirement assessment Seniority aid area peer acquire knowledge interview staff interact Developer investigation abreast position skill communication conscientiousness tool Code Performance colleague decision Subversion andor satisfaction aspect program CFS care lead Handle support management process roadblock conflict alternative convention proactiveness Engineering responsibility Indicators Description fitness product team place set effort responsiveness stakeholder deal terseness JIRA design maintainability risk Variation desire document considerate Software work Studio developer cfs manager way purpose discussion rest development eg complexity note improvement issue Development productivity project execute client accord survey escalate,able abreast accord account acquire activities aid alternative analysis andor applicable application appropriate appropriately area aspect assess assessment associate balance bamboo be behaviour behind business care cfs change client code colleague communicate communication competencies complexity conduct conflict conscientiousness considerate construction contributes convention customer day deal decision delivery description design desire detail detect developer development discussion document duties effectively efficiency efficiently effort eg elicits engage engineering ensure escalate execute exercise expect expectation expectations explain fitness follow formally functional general good handle high how identify improve improvement include independently indicators inform informally interact interview investigation issue jira job judgement keep keeps key knowledge lead level maintainability make management manager manages meet more need new none nonfunctional note open other participation peer perform performance place position positions possible proactive proactiveness process product production productivity professionally program progress project provide purpose quality rationale reach reduce relevant reliability reporting reports require requirement resolve responsibilities responsibility responsive responsiveness rest reuseability risk roadblock robustness satisfaction schedule senior seniority set skill soft software staff stakeholder standard studio subject subversion sufficiently suggest support survey take task team technical technique technology terseness test testable tester testing thing thoroughness time title together tool tradeoff use variation vary verbal visual way well wherever work works write
Director of Engineering.docx,"Director of Engineering, Google CloudDirector of Engineering, Google Cloud

Minimum qualifications:



Bachelor's degree in Computer Science or equivalent practical experience.

10 years of experience in networking, distributed systems, and programming languages.

10 years of experience managing diverse engineering teams.

Preferred qualifications:



Advanced business or technical degree.

Measurable track record in creating, executing and delivering a technical vision.

In-depth experience operating within and leading cross-functional teams.

Effective product sensibility, with capability to advocate and drive key product innovations or opportunities with the developer community.

Excellent written and verbal communication skills in English with the ability to represent and advocate complex technical concepts.

Demonstrated passion for and thought leadership within networking, programming languages and distributed systems.

About the job

As the Director of Engineering, you will bring your technical and engineering management skills to ensure evolution and success of communication frameworks, including next-generation imperative programming development environments and transformative high-performance RPC systems.



You will manage and grow a team of engineering managers and technical leads, while also managing and driving the vision and strategy for these frameworks. You will partner with technical leaders in your team and in customer teams, such as Search, Ads and Youtube, and drive adoption of new communications frameworks across Google.



Google Cloud provides organizations with leading infrastructure, platform capabilities and industry solutions. We deliver enterprise-grade cloud solutions that leverage Google’s cutting-edge technology to help companies operate more efficiently and adapt to changing needs, giving customers a foundation for the future. Customers in more than 150 countries turn to Google Cloud as their trusted partner to solve their most critical business problems.



Responsibilities

Serve as one of the primary points of contact for key customers at Google, defining product and adoption strategies and executing plans.

Collaborate with developers across Google to drive developer productivity and efficiency of communication stacks.

Track, understand, and interpret key usage and efficiency metrics to understand the current state and to ultimately make impactful data-driven technical and business decisions.

Manage, lead, and grow a team of technical leaders and engineering managers to achieve goals. Work with cross-functional teams to improve developer productivity and efficiency of communications stack.

Create, communicate and advocate a strategy for bringing Google’s innovations to Google Cloud and the rest of the industry.",Director Engineering Google CloudDirector Engineering Google Cloud Minimum qualification Bachelors degree Computer Science equivalent practical experience year experience networking distribute system programming language year experience manage diverse engineering team preferred qualification advanced business technical degree measurable track record create executing deliver technical vision indepth experience operate lead crossfunctional team effective product sensibility capability advocate drive key product innovation opportunitie developer community Excellent write verbal communication skill english ability represent advocate complex technical concept demonstrate passion think leadership networking programming language distribute system job Director Engineering bring technical engineering management skill ensure evolution success communication framework include nextgeneration imperative programming development environment transformative highperformance RPC system manage grow team engineering manager technical lead also manage drive vision strategy framework partner technical leader team customer team Search Ads Youtube drive adoption new communication framework Google Google Cloud provide organization lead infrastructure platform capability industry solution deliver enterprisegrade cloud solution leverage Googles cuttingedge technology help company operate efficiently adapt change need give customer foundation future customer country turn Google Cloud trust partner solve critical business problem responsibility serve primary point contact key customer Google define product adoption strategy execute plan collaborate developer Google drive developer productivity efficiency communication stack Track understand interpret key usage efficiency metric understand current state ultimately make impactful datadriven technical business decision manage lead grow team technical leader engineering manager achieve goal work crossfunctional team improve developer productivity efficiency communication stack create communicate advocate strategy bring Googles innovation Google Cloud rest industry,represent collaborate practical change verbal need leader adoption usage sensibility manage goal company community demonstrate state ultimately imperative environment innovation Youtube interpret degree highperformance technical nextgeneration distribute equivalent technology efficiency customer leadership effective english also business current cloud Excellent Search contact datadriven communicate think ensure Track concept turn trust infrastructure crossfunctional organization enterprisegrade programming provide Director Cloud strategy diverse adapt job key help metric partner serve engineering primary advocate communication skill system achieve Ads indepth include efficiently vision transformative evolution drive advanced Googles decision create platform make improve bring lead plan measurable networking success management critical grow give Engineering deliver write responsibility operate product team qualification Minimum passion leverage new Google cuttingedge solve opportunitie experience executing ability solution Science understand track RPC preferred point industry complex framework Computer record stack work capability developer manager problem country year CloudDirector language foundation rest development future define impactful execute productivity Bachelors,change need leader adoption usage sensibility goal company community state environment innovation Youtube degree highperformance nextgeneration technology efficiency customer leadership english cloud Excellent Search contact communicate Track concept trust infrastructure organization enterprisegrade programming Director Cloud strategy diverse adapt job key help partner advocate communication skill system Ads indepth vision transformative evolution Googles decision platform make improve lead plan networking success management Engineering responsibility product team qualification passion leverage Google cuttingedge experience ability solution Science track RPC point industry framework Computer record stack work capability developer manager problem country year CloudDirector language foundation rest development future execute productivity,ability achieve adapt adoption ads advanced advocate also bachelors bring business capability change cloud clouddirector collaborate communicate communication community company complex computer concept contact country create critical crossfunctional current customer cuttingedge datadriven decision define degree deliver demonstrate developer development director distribute diverse drive effective efficiency efficiently engineering english ensure enterprisegrade environment equivalent evolution excellent execute executing experience foundation framework future give goal google googles grow help highperformance impactful imperative improve include indepth industry infrastructure innovation interpret job key language lead leader leadership leverage make manage management manager measurable metric minimum need networking new nextgeneration operate opportunitie organization partner passion plan platform point practical preferred primary problem product productivity programming provide qualification record represent responsibility rest rpc science search sensibility serve skill solution solve stack state strategy success system team technical technology think track transformative trust turn ultimately understand usage verbal vision work write year youtube
